{"map_bindings":{"/freshness_refs":"sha256:456f4a72704603e6806b05c942264067ca4feb6ef37a5325b8fff4d2aeeb2359","/input_refs":"sha256:456f4a72704603e6806b05c942264067ca4feb6ef37a5325b8fff4d2aeeb2359"},"record":{"action_id":"action.example","change_id":"change.example","context_digest":"sha256:0000000000000000000000000000000000000000000000000000000000000000","execution":{"context_bytes":128},"id":"result.387e1487ec27151dc41b","output_refs":[],"payload":{"summary":"Preserve the recorded implementation and input references."},"result_schema":"result.build","role":"Builder","schema_version":"1"},"record_digest":"sha256:af6693bddb2b05e4090a08d6d3a8aac410a8c993245cc4156c5a7fddf7355eaa","record_kind":"result","reference_maps":{"sha256:456f4a72704603e6806b05c942264067ca4feb6ef37a5325b8fff4d2aeeb2359":{"code.example.0":"sha256:aaaaaaaaaaaaaaaaaaaaaaaaaaaaaaaaaaaaaaaaaaaaaaaaaaaaaaaaaaaaaaaa","code.example.1":"sha256:aaaaaaaaaaaaaaaaaaaaaaaaaaaaaaaaaaaaaaaaaaaaaaaaaaaaaaaaaaaaaaaa","code.example.10":"sha256:aaaaaaaaaaaaaaaaaaaaaaaaaaaaaaaaaaaaaaaaaaaaaaaaaaaaaaaaaaaaaaaa","code.example.11":"sha256:aaaaaaaaaaaaaaaaaaaaaaaaaaaaaaaaaaaaaaaaaaaaaaaaaaaaaaaaaaaaaaaa","code.example.12":"sha256:aaaaaaaaaaaaaaaaaaaaaaaaaaaaaaaaaaaaaaaaaaaaaaaaaaaaaaaaaaaaaaaa","code.example.13":"sha256:aaaaaaaaaaaaaaaaaaaaaaaaaaaaaaaaaaaaaaaaaaaaaaaaaaaaaaaaaaaaaaaa","code.example.14":"sha256:aaaaaaaaaaaaaaaaaaaaaaaaaaaaaaaaaaaaaaaaaaaaaaaaaaaaaaaaaaaaaaaa","code.example.15":"sha256:aaaaaaaaaaaaaaaaaaaaaaaaaaaaaaaaaaaaaaaaaaaaaaaaaaaaaaaaaaaaaaaa","code.example.2":"sha256:aaaaaaaaaaaaaaaaaaaaaaaaaaaaaaaaaaaaaaaaaaaaaaaaaaaaaaaaaaaaaaaa","code.example.3":"sha256:aaaaaaaaaaaaaaaaaaaaaaaaaaaaaaaaaaaaaaaaaaaaaaaaaaaaaaaaaaaaaaaa","code.example.4":"sha256:aaaaaaaaaaaaaaaaaaaaaaaaaaaaaaaaaaaaaaaaaaaaaaaaaaaaaaaaaaaaaaaa","code.example.5":"sha256:aaaaaaaaaaaaaaaaaaaaaaaaaaaaaaaaaaaaaaaaaaaaaaaaaaaaaaaaaaaaaaaa","code.example.6":"sha256:aaaaaaaaaaaaaaaaaaaaaaaaaaaaaaaaaaaaaaaaaaaaaaaaaaaaaaaaaaaaaaaa","code.example.7":"sha256:aaaaaaaaaaaaaaaaaaaaaaaaaaaaaaaaaaaaaaaaaaaaaaaaaaaaaaaaaaaaaaaa","code.example.8":"sha256:aaaaaaaaaaaaaaaaaaaaaaaaaaaaaaaaaaaaaaaaaaaaaaaaaaaaaaaaaaaaaaaa","code.example.9":"sha256:aaaaaaaaaaaaaaaaaaaaaaaaaaaaaaaaaaaaaaaaaaaaaaaaaaaaaaaaaaaaaaaa"}},"storage_format":"adf-record-refmaps-v1"}
